{
  "domain": "discord.com",
  "name": null,
  "passkey_signin": true,
  "passkey_mfa": true,
  "additional_domains": [],
  "category": null,
  "region": "global",
  "documentation": "https://support.discord.com/hc/en-us/articles/219576828",
  "sources": [
    "2factorauth",
    "dashlane"
  ],
  "added": "2026-06-25"
}
