{
  "domain": "deakin.edu.au",
  "name": null,
  "passkey_signin": false,
  "passkey_mfa": true,
  "additional_domains": [],
  "category": null,
  "region": "global",
  "documentation": "https://help.deakin.edu.au/ithelp?id=kb_article&sysparm_article=KB0014662",
  "sources": [
    "2factorauth"
  ],
  "added": "2026-06-25"
}
