{
  "domain": "hyatt.com",
  "name": null,
  "passkey_signin": true,
  "passkey_mfa": false,
  "additional_domains": [],
  "category": null,
  "region": "global",
  "documentation": "https://www.hyatt.com/member/passkey/what-is-passkey",
  "sources": [
    "2factorauth",
    "dashlane"
  ],
  "added": "2026-06-25"
}
