{
  "domain": "merrilledge.com",
  "name": null,
  "passkey_signin": false,
  "passkey_mfa": true,
  "additional_domains": [],
  "category": null,
  "region": "global",
  "documentation": "https://www.ml.com/privacy-and-security-center/usb-security-key.html",
  "sources": [
    "2factorauth"
  ],
  "added": "2026-06-25"
}
