{
  "domain": "oregonstate.edu",
  "name": null,
  "passkey_signin": false,
  "passkey_mfa": true,
  "additional_domains": [],
  "category": null,
  "region": "global",
  "documentation": "https://oregonstate.teamdynamix.com/TDClient/1935/Portal/KB/?CategoryID=8235",
  "sources": [
    "2factorauth"
  ],
  "added": "2026-06-25"
}
