{
  "domain": "ebay.com.au",
  "name": null,
  "passkey_signin": true,
  "passkey_mfa": false,
  "additional_domains": [],
  "category": null,
  "region": "global",
  "documentation": "https://www.ebay.com/help/account/signing-account/signing-account?id=4189#section2",
  "sources": [
    "2factorauth",
    "dashlane"
  ],
  "added": "2026-06-25"
}
