{
  "domain": "id.me",
  "name": null,
  "passkey_signin": true,
  "passkey_mfa": true,
  "additional_domains": [],
  "category": null,
  "region": "global",
  "documentation": "https://help.id.me/hc/en-us/articles/360018113053",
  "sources": [
    "2factorauth",
    "dashlane"
  ],
  "added": "2026-06-25"
}
