{
  "domain": "doppler.com",
  "name": null,
  "passkey_signin": false,
  "passkey_mfa": true,
  "additional_domains": [],
  "category": null,
  "region": "global",
  "documentation": "https://docs.doppler.com/docs/security-fact-sheet#user-authentication",
  "sources": [
    "2factorauth"
  ],
  "added": "2026-06-25"
}
