{
  "domain": "amazon.com.tr",
  "name": null,
  "passkey_signin": true,
  "passkey_mfa": false,
  "additional_domains": [],
  "category": null,
  "region": "global",
  "documentation": "https://www.amazon.com/gp/help/customer/display.html?nodeId=TPphmhSWBgcI9Ak87p",
  "sources": [
    "2factorauth"
  ],
  "added": "2026-06-25"
}
