{
  "domain": "npmjs.com",
  "name": null,
  "passkey_signin": false,
  "passkey_mfa": true,
  "additional_domains": [],
  "category": null,
  "region": "global",
  "documentation": "https://docs.npmjs.com/configuring-two-factor-authentication",
  "sources": [
    "2factorauth"
  ],
  "added": "2026-06-25"
}
