{
  "domain": "ubereats.com",
  "name": null,
  "passkey_signin": true,
  "passkey_mfa": false,
  "additional_domains": [],
  "category": null,
  "region": "global",
  "documentation": "https://help.uber.com/riders/article/-?nodeId=61701cda-3615-43b2-8187-1440e91035d8",
  "sources": [
    "2factorauth"
  ],
  "added": "2026-06-25"
}
