{
  "domain": "grab.com",
  "name": null,
  "passkey_signin": true,
  "passkey_mfa": false,
  "additional_domains": [],
  "category": null,
  "region": "global",
  "documentation": "https://engineering.grab.com/embracing-passwordless-authentication-with-passkey",
  "sources": [
    "2factorauth",
    "dashlane"
  ],
  "added": "2026-06-25"
}
