{
  "domain": "pm.me",
  "name": null,
  "passkey_signin": false,
  "passkey_mfa": true,
  "additional_domains": [],
  "category": null,
  "region": "global",
  "documentation": "https://proton.me/support/two-factor-authentication-2fa",
  "sources": [
    "2factorauth"
  ],
  "added": "2026-06-25"
}
