{
  "domain": "goteleport.com",
  "name": null,
  "passkey_signin": false,
  "passkey_mfa": true,
  "additional_domains": [],
  "category": null,
  "region": "global",
  "documentation": "https://goteleport.com/docs/access-controls/guides/webauthn/",
  "sources": [
    "2factorauth"
  ],
  "added": "2026-06-25"
}
